<project name="auth-flow"
         stack="nextjs"
         version="0.1.0"
         xmlns:xsi="http://www.w3.org/2001/XMLSchema-instance"
         xsi:noNamespaceSchemaLocation="../pxml.xsd"
         autogen-tests="true">

  <node id="api.auth" type="api-route" flow="auth.manage">
    <meta>
      <path>app/api/auth/route.ts</path>
    </meta>
    <input>
      <field name="email" type="string" required="true" />
      <field name="password" type="string" required="true" />
      <field name="action" type="string" required="true" />
    </input>
    <output>
      <field name="success" type="boolean" required="true" />
    </output>
    <constraint verify="static">Use the shared database connection imported from '@/lib/db' (or relative path) for all database operations instead of creating new Database instances. Initialize tables if not exists using the shared connection. Implement a POST handler: if body contains action 'register', insert the user into database. If action 'login', select user, verify password, set a cookie named 'user_session' with the email value (acting as session identifier), and return success. Ensure the route is dynamic and not cached by exporting: export const dynamic = 'force-dynamic';</constraint>
    <test>
      <name>Register user successfully</name>
      <given>
        <body json="true">
          <email>test@example.com</email>
          <password>password123</password>
          <action>register</action>
        </body>
      </given>
      <expect>
        <status>200</status>
        <contains>success</contains>
      </expect>
    </test>
  </node>

  <node id="ui.auth" type="ui-component" flow="auth.view">
    <meta>
      <path>app/login/page.tsx</path>
      <depends_on>api.auth</depends_on>
    </meta>
    <constraint verify="static">File exports default React component</constraint>
    <constraint verify="static">Form makes POST requests to '/api/auth' with action 'login' or 'register' on submit</constraint>
    <constraint verify="llm-judge">Create a login and registration page at app/login/page.tsx (Amazon classic sign-in design). Display a card containing forms for both Sign-In and Create Account. On success, store user state, set session cookies, and redirect to products catalog page at '/products'.</constraint>
  </node>

</project>
