<project name="cart-flow"
         stack="nextjs"
         version="0.1.0"
         xmlns:xsi="http://www.w3.org/2001/XMLSchema-instance"
         xsi:noNamespaceSchemaLocation="../pxml.xsd"
         autogen-tests="true">

  <node id="api.cart" type="api-route" flow="cart.manage">
    <meta>
      <path>app/api/cart/route.ts</path>
    </meta>
    <input>
      <field name="productId" type="number" required="true" />
      <field name="quantity" type="number" required="true" />
    </input>
    <output>
      <field name="success" type="boolean" required="false" />
    </output>
    <constraint verify="static">Use the shared database connection imported from '@/lib/db' (or relative path) for all database operations instead of creating new Database instances. Create cart table (id INTEGER PRIMARY KEY AUTOINCREMENT, productId INTEGER UNIQUE, quantity INTEGER) if not exists. Support POST (add/increment item), GET (returns array list of items joined with product details from products table), PUT (update quantity), and DELETE (clear/remove item). Ensure the route is dynamic and not cached by exporting: export const dynamic = 'force-dynamic';</constraint>
    <test>
      <name>Add item to cart successful</name>
      <given>
        <body json="true">
          <productId>1</productId>
          <quantity>1</quantity>
        </body>
      </given>
      <expect>
        <status>200</status>
      </expect>
    </test>
  </node>

  <node id="ui.cart" type="ui-component" flow="cart.view">
    <meta>
      <path>app/cart/page.tsx</path>
      <depends_on>api.cart</depends_on>
    </meta>
    <constraint verify="static">File exports default React component</constraint>
    <constraint verify="static">Fetch cart items from '/api/cart' on mount</constraint>
    <constraint verify="static" learned-from="cart.badge">Always fetch active cart status from backend database route, never from localStorage to ensure cart badge count displays correctly.</constraint>
    <constraint verify="llm-judge">Create a shopping cart summary page at app/cart/page.tsx. Note that the GET handler returns an array list of items directly. Display items, support quantity updates, single deletion, and checkout redirection.</constraint>
  </node>

</project>
