<project name="checkout-flow" stack="nextjs" version="0.1.0"
         xmlns:xsi="http://www.w3.org/2001/XMLSchema-instance"
         xsi:noNamespaceSchemaLocation="../pxml.xsd">

  <node id="api.checkout" type="api-route" flow="checkout.manage">
    <meta>
      <path>app/api/checkout/route.ts</path>
    </meta>
    <constraint verify="static">Initialize better-sqlite3 database at path.resolve(process.cwd(), 'shop.db') lazily inside handlers (not at top level of the module to prevent import crashes). Create an 'orders' table (columns: id INTEGER PRIMARY KEY AUTOINCREMENT, totalAmount REAL, itemsCount INTEGER, date TEXT, fullName TEXT, address TEXT) if not exists. Support POST: reads all items in 'cart', calculates total sum, inserts a new order row, clears the 'cart' table, and returns the generated orderId. Support GET: returns all orders history sorted by date descending.</constraint>
  </node>

  <node id="ui.checkout" type="ui-component" flow="checkout.view">
    <meta>
      <path>app/checkout/page.tsx</path>
      <depends_on>api.checkout</depends_on>
    </meta>
    <constraint verify="static">Create a checkout form page at app/checkout/page.tsx (Amazon multi-step styling). Display shipping fields (Full Name, Address, City, Zip). Display cart summary, calculate total, and show a 'Place your order' yellow button that POSTs to '/api/checkout' and redirects to '/orders' with a success message.</constraint>
  </node>

  <node id="ui.orders" type="ui-component" flow="checkout.history">
    <meta>
      <path>app/orders/page.tsx</path>
      <depends_on>api.checkout</depends_on>
    </meta>
    <constraint verify="static">Create an orders history view at app/orders/page.tsx. Fetch orders list from '/api/checkout' on mount. Display previous orders with order card columns (Order Placed date, Total Cost, Ship To address, Status: Delivered/Shipped mock status). Add a button linking back to '/products' to continue shopping.</constraint>
  </node>

</project>
